entry,investigate,preview,leave
"The wind howls through the icy tundra, carrying with it a haunting melody. Your breaths come out in plumes of frost as you set foot into this frigid land.","You find a set of tracks that appear to belong to a massive creature. They seem to be fresh, and you're left wondering what kind of beast could brave this harsh environment.","In the distance, you spot what appears to be an aurora borealis. The lights dance and sway, creating a breathtaking display that leaves you in awe.","You hear the howls of wolves in the distance, a sound that makes you shiver. It's time to leave before they get too close."
"As you enter this frozen wonderland, you can't help but marvel at the massive glaciers that seem to stretch on for miles. You can almost hear the ice creaking beneath your feet.","You stumble upon a pack of arctic foxes. They seem curious of you, and you can't help but feel a sense of wonder as you watch them play.","The snow crunches beneath your feet as you make your way deeper into this frozen forest. The towering trees are coated in a layer of frost, creating an eerie and beautiful landscape.","As the sun begins to set, you can feel the chill of night starting to set in. It's time to find shelter before the true cold sets in."
"The frigid air seems to bite at your skin as you venture deeper into this frozen desert. You can see the sun glinting off of snow dunes in the distance.","You find yourself standing at the edge of a massive cliff, peering out into the endless expanse of white. The beauty of this frigid wasteland leaves you breathless.","The silence of this frozen land is only broken by the occasional sound of snow being blown about by the wind. It's an eerie feeling, but also a peaceful one.","As you turn to leave, you see what looks like a polar bear in the distance. It's time to move quickly before it notices you."
"You find yourself in a frozen valley, surrounded by jagged peaks and snow drifts. The silence here is absolute, save for the sound of your own breathing.","As you move through the snow drifts, you spot what appears to be the entrance to an ice cave. The possibility of treasure beckons, but so does danger.","In the distance, you can see the hulking form of a woolly mammoth. It seems to be grazing on the sparse vegetation that grows here, and you can't help but feel awestruck.","As you turn to leave, you're struck by the beauty of the snow-covered landscape. You're hesitant to leave, but you know that it's not safe to stay for long."
"The snow crunches beneath your feet as you step into the frigid tundra. The icy wind bites at your cheeks, but you're determined to explore this frozen wasteland.","As you investigate the area, you come across a cluster of polar bears huddled together for warmth. You marvel at their thick fur and wonder how they survive in this unforgiving environment.","You notice a faint glimmer in the distance and decide to follow it. As you approach, you see that it's a frozen lake, its surface glittering in the pale winter sun.","With a shiver, you turn back and head towards the warmth of your camp. The frigid tundra is beautiful, but you're grateful to leave it behind."
"You step into a thick forest of snow-covered evergreens. The trees tower above you, their branches heavy with snow.","As you investigate the forest, you come across a family of reindeer grazing on lichen-covered rocks. You watch in awe as they gracefully bound away.","You catch sight of the Northern Lights in the sky above, its greens and blues dancing across the frigid night sky.","You take one last look at the majestic forest before making your way back to your warm cabin."
"The sound of crunching ice fills the air as you step onto a frozen river. You look down and see that the ice is thick enough to support your weight.","As you investigate the frozen river, you come across a group of penguins waddling across the ice. You can't help but smile at their awkward yet endearing movements.","In the distance, you spot a glacier, its icy blue surface sparkling in the sunlight. You can't resist the urge to get closer and take a better look.","You turn back as the sun begins to set, casting a pink and orange glow across the frozen landscape. It's time to leave the frigid beauty behind and return to warmth."
"You take a deep breath and step into a vast expanse of snow and ice. The cold is bone-chilling, but the beauty of the frigid landscape is worth it.","As you investigate, you come across a group of arctic foxes playfully chasing each other through the snow. You watch in amusement for a while before continuing on.","In the distance, you spot a frozen waterfall, its icy surface sparkling in the sunlight. You can't resist the urge to get closer and take a better look.","You turn back as the sun begins to set, casting a pink and orange glow across the frozen landscape. It's time to leave the frigid beauty behind and return to warmth."
"As you step into this frozen wasteland, you are greeted by the sight of snow-covered trees and icy mountains looming in the distance. The frigid air bites at your cheeks, reminding you that you are far from civilization.","You notice a faint light flickering in the distance, and curiosity gets the better of you. As you approach, you realize that it is a campfire, and you can see the shadow of a person huddled over it.","The snow crunches beneath your feet as you follow the path through the forest, your breath fogging up in front of you. Ahead, you can see a frozen lake, its surface shimmering in the sunlight.","As you make your way out of the frigid forest, you take one last look at the icy terrain around you. Despite the harsh conditions, there is a haunting beauty to this desolate landscape that you will never forget."
"You find yourself standing at the edge of a frozen river, its surface glinting in the sunlight. The silence is almost deafening, broken only by the occasional sound of cracking ice. You wonder what secrets lie beneath the frozen surface.","As you trudge through the snow, you come across a cave entrance half-buried in the snowdrifts. It looks like it could be a good place to take shelter, but you can't shake the feeling that something is watching you from the darkness inside.","The wind howls through the trees as you follow the path through the frozen forest. You catch a glimpse of a pack of wolves in the distance, their eyes gleaming in the moonlight.","As you turn to leave the frigid forest behind, you realize that your footprints have been erased by the blowing snow. It's as if you were never there at all."
"You feel a chill run down your spine as you gaze out at the frozen tundra, stretching out as far as the eye can see. The landscape is barren and lifeless, and you wonder how anything could survive in such a harsh environment.","You stumble upon a small abandoned cabin, half-buried in the snow. The windows are boarded up, but you can see a faint glow emanating from within.","As you trek through the frigid forest, you can hear the sound of your footsteps echoing in the silence. The trees are barren and covered in frost, as if they are frozen in time.","You make your way out of the frigid forest, grateful to leave the desolate landscape behind. The warmth of the sun on your face is a welcome relief from the biting cold."
"The frigid air stings your lungs as you step into the frozen wasteland. The snow crunches beneath your feet, and the trees are bare and lifeless. You wonder what could have caused such devastation.","You spot a figure in the distance, bundled up in furs and carrying a large pack. As you approach, you realize that they are a trader, and they may have valuable supplies to trade.","You come across a frozen waterfall, its surface covered in icicles that glitter in the sunlight. The sound of the frozen water is strangely soothing, and you find yourself mesmerized by its beauty.","As you make your way out of the frigid forest, you can't help but feel a sense of relief. The biting cold and barren landscape were almost too much to bear."